placename,description,state,image,price_estimated_range
Coorg,"Similar to Chikkamagaluru, Coorg is known for its coffee plantations, scenic beauty, and pleasant climate, ideal for couples interested in nature and relaxation.",Karnataka,Coorg.webp,₹6000 - ₹20000
Wayanad,"Wayanad offers lush greenery, wildlife sanctuaries, and trekking opportunities, making it a great alternative for nature-loving couples.",Kerala,Wayanad.webp,₹5000 - ₹18000
Leh-Ladakh,Similar high-altitude desert landscape with monasteries and adventure activities.,Ladakh,Leh-Ladakh.webp,₹45000-₹55000
Kinnaur,Another beautiful valley in Himachal Pradesh with stunning views and monasteries.,Himachal Pradesh,Kinnaur.webp,₹35000-₹45000
Tawang,Remote Himalayan town with monasteries and scenic beauty.,Arunachal Pradesh,Tawang.webp,₹35000-₹45000
Mcleod Ganj,"Similar to Tawang, Mcleod Ganj offers a blend of Tibetan culture, monasteries, and scenic beauty, ideal for friends seeking adventure and cultural experiences.",Himachal Pradesh,Mcleod_Ganj.webp,₹35000-₹45000
Pondicherry,"Similar to Goa with a French colonial influence, beaches, and relaxed vibe, suitable for couples seeking a mix of culture and relaxation.",Puducherry,,"₹10,000 - ₹40,000"
Gokarna,"A quieter alternative to Goa, offering beautiful beaches, temples, and a more laid-back atmosphere, ideal for adventure-seeking couples.",Karnataka,Gokarna.webp,"₹8,000 - ₹30,000"
Amarnath Cave,"Another significant Hindu shrine in Jammu & Kashmir, known for its ice lingam and challenging trek, appealing to those seeking religious pilgrimage and trekking experiences.",Jammu & Kashmir,Amarnath_Cave.webp,"₹6,000 - ₹18,000"
Haridwar,"A major Hindu pilgrimage site in Uttarakhand, known for its ghats along the Ganges River and numerous temples, offering a similar religious and spiritual experience.",Uttarakhand,Haridwar.webp,"₹4,000 - ₹12,000"
Haridwar and Rishikesh,"Located in Uttarakhand, these cities are known for their religious significance, yoga retreats, and adventure activities, offering a blend of spirituality and nature.",Uttarakhand,Haridwar_and_Rishikesh.webp,"₹6,000 - ₹18,000"
Varanasi,"Similar to Haridwar, Varanasi is a major Hindu pilgrimage site on the banks of the Ganges, known for its ghats and spiritual significance.",Uttar Pradesh,Varanasi.webp,₹5000-₹12000
Rishikesh,"Close to Haridwar, Rishikesh is known for its yoga centers, adventure activities, and spiritual atmosphere, making it a great alternative for trekking and spiritual experiences.",Uttarakhand,Rishikesh.webp,₹4000-₹10000
Bodh Gaya,"The most important Buddhist pilgrimage site, offering a spiritual experience similar to Sarnath in Varanasi.",Bihar,Bodh_Gaya.webp,"₹4,000 - ₹18,000"
Ayodhya,"Birthplace of Lord Rama, a significant religious site for Hindus.",Uttar Pradesh,Ayodhya.webp,"₹4,000 - ₹18,000"
Prayagraj,"Another holy city in Uttar Pradesh, known for the Triveni Sangam, the meeting point of three rivers.",Uttar Pradesh,Prayagraj.webp,"₹6,000 - ₹20,000"
Prayagraj (Allahabad),"Another holy city in Uttar Pradesh, known for the Triveni Sangam, the confluence of the Ganges, Yamuna, and Saraswati rivers, offering a similar religious experience.",Uttar Pradesh,Prayagraj_(Allahabad).webp,"₹4,000 - ₹18,000"
Munnar,"Similar to Coorg, Munnar is a hill station in Kerala known for its tea plantations, scenic beauty, and pleasant climate, making it ideal for nature and photography enthusiasts.",Kerala,Munnar.webp,₹5500-₹16000
Ooty,"Ooty, in Tamil Nadu, offers similar experiences with its botanical gardens, tea estates, and scenic landscapes, appealing to those interested in nature and sightseeing.",Tamil Nadu,Ooty.webp,₹5000-₹14000
Humayun's Tomb,"Similar Mughal architecture and historical significance, located in Delhi.",Delhi,Humayun's_Tomb.webp,₹5000-₹15000
Fatehpur Sikri,"A historical city near Agra, showcasing Mughal architecture and history.",Uttar Pradesh,Fatehpur_Sikri.webp,₹7000-₹20000
Hampi,"Similar to Fatehpur Sikri, Hampi offers a rich historical experience with its ruins and temples, perfect for sightseeing and photography.",Karnataka,,"₹4,000 - ₹40,000"
Khajuraho,"Known for its ancient temples and intricate sculptures, Khajuraho is ideal for couples interested in historical sites and photography.",Madhya Pradesh,Khajuraho.webp,"₹3,500 - ₹35,000"
Agra,"Home to the Taj Mahal and other Mughal-era monuments, offering a rich historical and cultural experience.",Uttar Pradesh,Agra.webp,"₹5,000 - ₹20,000"
Delhi,"Capital city with numerous historical sites, including Humayun's Tomb and Qutub Minar, reflecting diverse architectural styles.",Delhi,Delhi.webp,"₹4,000 - ₹18,000"
"Khajuraho, Madhya Pradesh","Known for its ancient temples and intricate sculptures, offering a similar cultural and historical experience.",Madhya Pradesh,"Khajuraho,_Madhya_Pradesh.webp",₹15000-₹45000
"Varanasi, Uttar Pradesh","A spiritual hub with ancient temples and ghats, providing a deep dive into Indian culture and traditions.",Uttar Pradesh,"Varanasi,_Uttar_Pradesh.webp",₹12000-₹40000
Orchha,"Orchha, like Khajuraho, features stunning temples and forts, providing a romantic and culturally enriching experience for couples.",Madhya Pradesh,Orchha.webp,₹6000 - ₹18000
Ajanta and Ellora Caves,"Features ancient rock-cut cave temples with rich history and intricate carvings, appealing to history and culture enthusiasts.",Maharashtra,Ajanta_and_Ellora_Caves.webp,₹6000 - ₹18000
Darjeeling,"Another hill station in West Bengal known for its tea plantations and Himalayan views, ideal for sightseeing and exploring with friends.",West Bengal,Darjeeling.webp,₹22000-₹48000
Shimla,"Similar hill station with colonial architecture and scenic views, suitable for sightseeing and nature walks.",Himachal Pradesh,Shimla.webp,₹20000-₹40000
Nainital,"Picturesque hill station with a beautiful lake, offering boating and scenic viewpoints, ideal for a relaxing trip.",Uttarakhand,Nainital.webp,₹18000-₹35000
Mussoorie,"Similar hill station in Uttarakhand with scenic views and pleasant weather, ideal for sightseeing and exploring.",Uttarakhand,Mussoorie.webp,₹12000-₹45000
